{
  "schema_version": "claim-evidence-ledger-v1",
  "artifact_id": "20260915-ios27-japan-trend-longform-v1-claims",
  "generated_at": "2026-09-15T11:22:37+00:00",
  "claims": [
    {
      "claim_id":"C01","normalized_claim":"Apple states iOS 27 is available in Japan on September 15, 2026.","claim_type":"EVENT","source_refs":["https://www.apple.com/jp/os/ios/"],"source_tier":"T1","source_independence_group":"APPLE_OFFICIAL","published_or_observed_at":"2026-09-15T00:00:00+09:00","retrieved_at":"2026-09-15T11:22:37+00:00","freshness_ttl_seconds":604800,"status":"VERIFIED","contradiction_status":"NONE_FOUND","blocking_for_publish":true,"script_span_ids":["S01-L01","S01-L02","S02-L04","S10-L01"],"scene_ids":["S01","S02","S10"],"caption_span_ids":["S01-L01","S01-L02","S02-L04","S10-L01"],"last_rechecked_at":"2026-09-15T11:22:37+00:00","notes":"Current Apple Japan iOS 27 product page."
    },
    {
      "claim_id":"C02","normalized_claim":"The term iOS27 appeared repeatedly in Twittrend's Japan X trend aggregation on September 15, including rank 13 at 05:00, 8 at 07:00, 10 at 08:00, and 11 at 12:00; regional lists also included it.","claim_type":"OTHER_FACTUAL","source_refs":["https://twittrend.jp/","https://twittrend.jp/time/23424856/"],"source_tier":"T4","source_independence_group":"TWITTREND_AGGREGATOR","published_or_observed_at":"2026-09-15T12:00:00+09:00","retrieved_at":"2026-09-15T11:22:37+00:00","freshness_ttl_seconds":604800,"status":"VERIFIED","contradiction_status":"NONE_FOUND","blocking_for_publish":true,"script_span_ids":["S02-L01","S02-L02","S10-L05"],"scene_ids":["S02","S10"],"caption_span_ids":["S02-L01","S02-L02","S10-L05"],"last_rechecked_at":"2026-09-15T11:22:37+00:00","notes":"Popularity/discovery signal only; not authority for product facts."
    },
    {
      "claim_id":"C03","normalized_claim":"Apple Japan currently states Siri AI begins with English and will become available in Japanese by the end of 2026.","claim_type":"PRODUCT_CAPABILITY","source_refs":["https://www.apple.com/jp/os/ios/","https://www.apple.com/jp/apple-intelligence/"],"source_tier":"T1","source_independence_group":"APPLE_OFFICIAL","published_or_observed_at":"2026-09-15T00:00:00+09:00","retrieved_at":"2026-09-15T11:22:37+00:00","freshness_ttl_seconds":86400,"status":"VERIFIED","contradiction_status":"NONE_FOUND","blocking_for_publish":true,"script_span_ids":["S01-L01","S01-L02","S02-L04","S03-L01","S04-L01","S04-L02","S04-L03","S04-L04","S10-L01","S10-L06"],"scene_ids":["S01","S02","S03","S04","S10"],"caption_span_ids":["S01-L01","S01-L02","S02-L04","S03-L01","S04-L01","S04-L02","S04-L03","S04-L04","S10-L01","S10-L06"],"last_rechecked_at":"2026-09-15T11:22:37+00:00","notes":"Volatile availability wording; recheck before publish handoff."
    },
    {
      "claim_id":"C04","normalized_claim":"iOS 27 supports iPhone 11 series and later, plus iPhone SE (2nd generation and later).","claim_type":"PRODUCT_CAPABILITY","source_refs":["https://www.apple.com/jp/os/ios/","https://support.apple.com/guide/iphone/iphone-models-compatible-with-ios-27-iphe3fa5df43/ios"],"source_tier":"T1","source_independence_group":"APPLE_OFFICIAL","published_or_observed_at":"2026-09-15T00:00:00+09:00","retrieved_at":"2026-09-15T11:22:37+00:00","freshness_ttl_seconds":2592000,"status":"VERIFIED","contradiction_status":"NONE_FOUND","blocking_for_publish":true,"script_span_ids":["S02-L04","S04-L05","S04-L06","S05-L01","S05-L02","S05-L05","S05-L06","S10-L02"],"scene_ids":["S02","S04","S05","S10"],"caption_span_ids":["S02-L04","S04-L05","S04-L06","S05-L01","S05-L02","S05-L05","S05-L06","S10-L02"],"last_rechecked_at":"2026-09-15T11:22:37+00:00","notes":"OS compatibility, not Apple Intelligence compatibility."
    },
    {
      "claim_id":"C05","normalized_claim":"Apple's iOS 27 page describes non-Siri changes including Liquid Glass customization, smarter Mail search, CPU-scheduler/system improvements, and advertised maximum speed improvements of 30% for app launch, 70% for new-photo library loading, and 80% for AirDrop transfer.","claim_type":"PRODUCT_CAPABILITY","source_refs":["https://www.apple.com/jp/os/ios/"],"source_tier":"T1","source_independence_group":"APPLE_OFFICIAL","published_or_observed_at":"2026-09-15T00:00:00+09:00","retrieved_at":"2026-09-15T11:22:37+00:00","freshness_ttl_seconds":2592000,"status":"VERIFIED","contradiction_status":"NONE_FOUND","blocking_for_publish":true,"script_span_ids":["S03-L02","S03-L03","S03-L04","S03-L05","S03-L06"],"scene_ids":["S03"],"caption_span_ids":["S03-L02","S03-L03","S03-L04","S03-L05","S03-L06"],"last_rechecked_at":"2026-09-15T11:22:37+00:00","notes":"Performance figures are Apple maximum claims and must be labeled as such."
    },
    {
      "claim_id":"C06","normalized_claim":"Apple Intelligence and Siri AI on iOS 27 require iPhone 16 or later, or iPhone 15 Pro / iPhone 15 Pro Max, while iOS 27 itself supports older devices.","claim_type":"PRODUCT_CAPABILITY","source_refs":["https://www.apple.com/jp/newsroom/2026/06/apple-unveils-next-generation-of-apple-intelligence-siri-ai-and-more/","https://www.apple.com/jp/apple-intelligence/"],"source_tier":"T1","source_independence_group":"APPLE_OFFICIAL","published_or_observed_at":"2026-06-08T00:00:00+09:00","retrieved_at":"2026-09-15T11:22:37+00:00","freshness_ttl_seconds":2592000,"status":"VERIFIED","contradiction_status":"NONE_FOUND","blocking_for_publish":true,"script_span_ids":["S02-L04","S04-L05","S04-L06","S05-L03","S05-L04","S05-L05","S05-L06","S10-L02"],"scene_ids":["S02","S04","S05","S10"],"caption_span_ids":["S02-L04","S04-L05","S04-L06","S05-L03","S05-L04","S05-L05","S05-L06","S10-L02"],"last_rechecked_at":"2026-09-15T11:22:37+00:00","notes":"Use iPhone 16 or later to cover later supported generations."
    },
    {
      "claim_id":"C07","normalized_claim":"ITmedia reported that Apple released iOS 27 and iOS 26.7 concurrently, with 126 CVEs listed as fixed for iOS 27 and 82 for iOS 26.7, 75 of them overlapping.","claim_type":"NUMERIC","source_refs":["https://www.itmedia.co.jp/mobile/articles/2609/15/news059.html"],"source_tier":"T2","source_independence_group":"ITMEDIA_SECURITY_SUMMARY","published_or_observed_at":"2026-09-15T08:45:00+09:00","retrieved_at":"2026-09-15T11:22:37+00:00","freshness_ttl_seconds":604800,"status":"VERIFIED","contradiction_status":"NONE_FOUND","blocking_for_publish":true,"script_span_ids":["S01-L03","S06-L01","S06-L02","S06-L03","S06-L04","S06-L05","S09-L04","S10-L03","S10-L04"],"scene_ids":["S01","S06","S09","S10"],"caption_span_ids":["S01-L03","S06-L01","S06-L02","S06-L03","S06-L04","S06-L05","S09-L04","S10-L03","S10-L04"],"last_rechecked_at":"2026-09-15T11:22:37+00:00","notes":"Secondary summary of Apple's security documents; do not equate fix counts directly with total risk."
    },
    {
      "claim_id":"C08","normalized_claim":"ITmedia observed a 21.05 GB iOS 27 update file on an iPhone 17 Pro on September 15; this is a device-specific observation, not a universal required size.","claim_type":"NUMERIC","source_refs":["https://www.itmedia.co.jp/mobile/spv/2609/15/news060.html"],"source_tier":"T2","source_independence_group":"ITMEDIA_DEVICE_OBSERVATION","published_or_observed_at":"2026-09-15T00:00:00+09:00","retrieved_at":"2026-09-15T11:22:37+00:00","freshness_ttl_seconds":604800,"status":"VERIFIED","contradiction_status":"NONE_FOUND","blocking_for_publish":true,"script_span_ids":["S07-L01","S07-L02","S07-L03"],"scene_ids":["S07"],"caption_span_ids":["S07-L01","S07-L02","S07-L03"],"last_rechecked_at":"2026-09-15T11:22:37+00:00","notes":"Never state 21.05 GB as the required size for every iPhone."
    },
    {
      "claim_id":"C09","normalized_claim":"NTT Docomo says that on iOS 27, when Connection Assist is ON and Wi-Fi is used under specified conditions, its Anshin Security dangerous-site protection may fail to block correctly; Docomo instructs users to turn Connection Assist OFF as a workaround.","claim_type":"PRODUCT_CAPABILITY","source_refs":["https://anshin-security.docomo.ne.jp/info/info-detail46.html"],"source_tier":"T1","source_independence_group":"DOCOMO_OFFICIAL","published_or_observed_at":"2026-09-15T00:00:00+09:00","retrieved_at":"2026-09-15T11:22:37+00:00","freshness_ttl_seconds":86400,"status":"VERIFIED","contradiction_status":"NONE_FOUND","blocking_for_publish":true,"script_span_ids":["S02-L04","S06-L06","S07-L06","S08-L01","S08-L02","S08-L03","S08-L04","S08-L05","S08-L06","S09-L04","S10-L03","S10-L04","S10-L05","S10-L06"],"scene_ids":["S02","S06","S07","S08","S09","S10"],"caption_span_ids":["S02-L04","S06-L06","S07-L06","S08-L01","S08-L02","S08-L03","S08-L04","S08-L05","S08-L06","S09-L04","S10-L03","S10-L04","S10-L05","S10-L06"],"last_rechecked_at":"2026-09-15T11:22:37+00:00","notes":"Specific service compatibility issue, not evidence that iOS 27 is generally unsafe."
    },
    {
      "claim_id":"C10","normalized_claim":"SBAPP reproduced on an iPhone 14 Pro a day-one UI issue where choosing Upgrade to iOS 27 displayed iOS 26.7, while the completed update was actually iOS 27; the same issue was not reproduced on its iPhone 11 Pro.","claim_type":"EVENT","source_refs":["https://sbapp.net/appnews/iphone/ios27/upgrade-shows-267-187747"],"source_tier":"T3","source_independence_group":"SBAPP_LOCAL_REPRODUCTION","published_or_observed_at":"2026-09-15T00:00:00+09:00","retrieved_at":"2026-09-15T11:22:37+00:00","freshness_ttl_seconds":604800,"status":"VERIFIED","contradiction_status":"NONE_FOUND","blocking_for_publish":true,"script_span_ids":["S07-L01","S07-L04","S07-L05","S07-L06"],"scene_ids":["S07"],"caption_span_ids":["S07-L01","S07-L04","S07-L05","S07-L06"],"last_rechecked_at":"2026-09-15T11:22:37+00:00","notes":"Local reproduction only; do not generalize to all devices."
    },
    {